{
  "$schema": "../schemas/source-hashes.schema.json",
  "schema_version": 1,
  "generated_at": "2026-10-10T08:58:59.0092866-07:00",
  "algorithm": "SHA-256",
  "target_root": ".",
  "input_sources": [
    {
      "migration_id": "MIG-001",
      "source": "X:\\Codex\\pch-single\\.gitattributes",
      "sha256": "D60F352D0DB1404C70AFB4BB8B2CA3FD1C610572AA40720E8A0B7BAA7885418C",
      "disposition": "COPIED"
    },
    {
      "migration_id": "MIG-002",
      "source": "X:\\Codex\\pch-single\\.github\\workflows\\ci.yml",
      "sha256": "8C0444857F767F50E4DD495DA45AA574AA9994FC05E3FDC3A40D717F090909AE",
      "disposition": "COPIED"
    },
    {
      "migration_id": "MIG-003",
      "source": "X:\\Codex\\pch-single\\.gitignore",
      "sha256": "655A71DD274442CB5000383341774262DB9802C7FD14A64474DD73C396C44385",
      "disposition": "COPIED"
    },
    {
      "migration_id": "MIG-004",
      "source": "X:\\Codex\\pch-single\\AGENTS.md",
      "sha256": "A90366DD4D6CDD1926D79626CF01A2B89AC4F74E218F68C09051666F9AEE2D79",
      "disposition": "COPIED"
    },
    {
      "migration_id": "MIG-005",
      "source": "X:\\Codex\\pch-single\\config\\default.json",
      "sha256": "99267434FBEDFFEB24946DEC6FAB833426C20832E729FE9B0922BFF0704D0825",
      "disposition": "COPIED"
    },
    {
      "migration_id": "MIG-006",
      "source": "X:\\Codex\\pch-single\\CONTRIBUTING.md",
      "sha256": "50F5A88326724BEC1C2123F664A35E79A15E10095366BE0CC37D47632552EF00",
      "disposition": "COPIED"
    },
    {
      "migration_id": "MIG-007",
      "source": "X:\\Codex\\pch-single\\docs\\ARCHITECTURE.md",
      "sha256": "E7E31FC1BF6D928198A7A05302CA874EA61CAA143555C43B441468EF8F68DD8F",
      "disposition": "COPIED"
    },
    {
      "migration_id": "MIG-008",
      "source": "X:\\Codex\\pch-single\\docs\\IMPLEMENTATION-PLAYBOOK.md",
      "sha256": "0F5E9F13A457A57F234E9B987A5BFB881E36CEB7A23E47D415ECDD38D1A03643",
      "disposition": "COPIED"
    },
    {
      "migration_id": "MIG-009",
      "source": "X:\\Codex\\pch-single\\docs\\PERFORMANCE-BUDGET.md",
      "sha256": "85D6B597C5D298EC8866A1D1EDD1C336332C1FE03770A92C47B0458CE3CC20B8",
      "disposition": "COPIED"
    },
    {
      "migration_id": "MIG-010",
      "source": "X:\\Codex\\pch-single\\docs\\PI-CODING-HARNESS-BLUEPRINT.md",
      "sha256": "DBF7143F1AEB8B1C624D610C7ED88E75D4727C5A434876A9FF64D148BBD121C9",
      "disposition": "COPIED"
    },
    {
      "migration_id": "MIG-011",
      "source": "X:\\Codex\\pch-single\\docs\\REVIEW-GATES.md",
      "sha256": "3BA45FF58157748AA8A4C5B3619E62E4D29E17F56AB3E5341417807EC9275180",
      "disposition": "COPIED"
    },
    {
      "migration_id": "MIG-012",
      "source": "X:\\Codex\\pch-single\\docs\\USER-GUIDE.md",
      "sha256": "91C4568F886C7FBA28FAD332E12AEA62CA97114EB09C75BADFCB6F8A1CA4CC3C",
      "disposition": "COPIED"
    },
    {
      "migration_id": "MIG-013",
      "source": "X:\\Codex\\pch-single\\docs\\VALIDATION.md",
      "sha256": "4482CA0F2F4A6C4433D2E89703FD30AFB9156B8551DB511A856B3484C8C4B091",
      "disposition": "COPIED"
    },
    {
      "migration_id": "MIG-014",
      "source": "X:\\Codex\\pch-single\\eslint.config.js",
      "sha256": "7D051519C3B91D6FD251949DB20F095835EA55AEFA1670EE9E35039AC5E5516E",
      "disposition": "COPIED"
    },
    {
      "migration_id": "MIG-015",
      "source": "X:\\Codex\\pch-single\\fixtures\\cache-observation.valid.json",
      "sha256": "F2E3C06B1F44F47C8C33307828E7983343F2A0A28344ACF54D69C7E72016D9B6",
      "disposition": "COPIED"
    },
    {
      "migration_id": "MIG-016",
      "source": "X:\\Codex\\pch-single\\fixtures\\checkpoint.valid.json",
      "sha256": "5F3C9514F057C96C96E9F05506B4EFBEC82461B230AE414FC6E905B85D63F3F7",
      "disposition": "COPIED"
    },
    {
      "migration_id": "MIG-017",
      "source": "X:\\Codex\\pch-single\\fixtures\\domain.valid.json",
      "sha256": "7048BBD3A68C551C0B2FF1FFAAF4592EE5B72E652C9DABC3CFE143AAD51FA570",
      "disposition": "COPIED"
    },
    {
      "migration_id": "MIG-018",
      "source": "X:\\Codex\\pch-single\\fixtures\\event.valid.json",
      "sha256": "E22E54140333289943290ED2346888630EFF826DEBB1F817126CA5551805925A",
      "disposition": "COPIED"
    },
    {
      "migration_id": "MIG-019",
      "source": "X:\\Codex\\pch-single\\fixtures\\memory-v3-capture-corpus.valid.json",
      "sha256": "51AE01F18F2CCD79AA622AD98EE1695E26581D84B4F24A54244664DF81D2822F",
      "disposition": "COPIED"
    },
    {
      "migration_id": "MIG-020",
      "source": "X:\\Codex\\pch-single\\fixtures\\output-observation.valid.json",
      "sha256": "FB0134C90B7CD9F030AA7DCF4FC03B4B7EBB95443526FEB9E89D06363601A3F0",
      "disposition": "COPIED"
    },
    {
      "migration_id": "MIG-021",
      "source": "X:\\Codex\\pch-single\\fixtures\\performance-contract.valid.json",
      "sha256": "E314DA3ABB3145842CAE50AEE8A36E4CDDAE229E61A1F6B4A2BDB92CCC780632",
      "disposition": "COPIED"
    },
    {
      "migration_id": "MIG-022",
      "source": "X:\\Codex\\pch-single\\fixtures\\performance-sample.valid.json",
      "sha256": "C080316911D5949A492B5F443410FB47CEAAC00C20A5EF0C1A65E65B23652AEE",
      "disposition": "COPIED"
    },
    {
      "migration_id": "MIG-023",
      "source": "X:\\Codex\\pch-single\\fixtures\\performance-trial.valid.json",
      "sha256": "FCE09666F65364F960782EB828BCC6F5E1929997BC7D8B8D0174CB9A8E929858",
      "disposition": "COPIED"
    },
    {
      "migration_id": "MIG-024",
      "source": "X:\\Codex\\pch-single\\fixtures\\performance-verdict.valid.json",
      "sha256": "DEA932A952ED62EE093EDE5BE495987A83CC592EC3C2D4791D219BDA0893CAFF",
      "disposition": "COPIED"
    },
    {
      "migration_id": "MIG-025",
      "source": "X:\\Codex\\pch-single\\fixtures\\performance\\node\\workload.mjs",
      "sha256": "F0F4BD3F4DB49DB57940985137F5F272B61FFCED8C34333D7B1CECE015B9CFF7",
      "disposition": "COPIED"
    },
    {
      "migration_id": "MIG-026",
      "source": "X:\\Codex\\pch-single\\fixtures\\performance\\powershell\\workload.ps1",
      "sha256": "73E7ECFEBFE29A457AD6D30C4E69E9889F36212D29DF4C3D1CF8297904E33B3A",
      "disposition": "COPIED"
    },
    {
      "migration_id": "MIG-027",
      "source": "X:\\Codex\\pch-single\\fixtures\\plan.valid.json",
      "sha256": "E59151EAAA2AB34FD0D5C7B28CA95A4B2EEB989B7F0224209DA4DA2240335684",
      "disposition": "COPIED"
    },
    {
      "migration_id": "MIG-028",
      "source": "X:\\Codex\\pch-single\\fixtures\\plans\\README.md",
      "sha256": "A368D4CC63E4F6267C1072F02CFFBBD8D87F9D05ADAF0B816CAF3A55FFDCCAA5",
      "disposition": "COPIED"
    },
    {
      "migration_id": "MIG-029",
      "source": "X:\\Codex\\pch-single\\fixtures\\prompt-generation.valid.json",
      "sha256": "07F64112CFDBDE6AB50AB2CA8D8B9CAB86C58614919546062978D970AF36DE1D",
      "disposition": "COPIED"
    },
    {
      "migration_id": "MIG-030",
      "source": "X:\\Codex\\pch-single\\fixtures\\prompt-request.valid.json",
      "sha256": "FEAD0527D6835F437106314CF736BB71F24D2496F33F8BA07F53942734B57136",
      "disposition": "COPIED"
    },
    {
      "migration_id": "MIG-031",
      "source": "X:\\Codex\\pch-single\\fixtures\\receipt.valid.json",
      "sha256": "58AD31A690A22BF71DAF3BC480960ABE24546D85866B55A5161280BB37D951C2",
      "disposition": "COPIED"
    },
    {
      "migration_id": "MIG-032",
      "source": "X:\\Codex\\pch-single\\fixtures\\requirements.valid.json",
      "sha256": "BEC2EF7A750D9F983009F3425617213278A7956BBCCEAEE8B440B3EC85951746",
      "disposition": "COPIED"
    },
    {
      "migration_id": "MIG-033",
      "source": "X:\\Codex\\pch-single\\fixtures\\requirements\\README.md",
      "sha256": "B7B82A4F440CD1002BF086E3381FF93CD67FD79D7BC4D5E0404F823A94D72290",
      "disposition": "COPIED"
    },
    {
      "migration_id": "MIG-034",
      "source": "X:\\Codex\\pch-single\\fixtures\\response-contract.valid.json",
      "sha256": "3C78D62FF1DFFCE1BF54E0DD4AC8D112647E5AAFE30E87418EB800C49F9B795A",
      "disposition": "COPIED"
    },
    {
      "migration_id": "MIG-035",
      "source": "X:\\Codex\\pch-single\\fixtures\\tool-result-projection.valid.json",
      "sha256": "1CB8B2F53B211103C1F2975DEFD5B47245F4A4B6016A7770D37F2797F1408D53",
      "disposition": "COPIED"
    },
    {
      "migration_id": "MIG-036",
      "source": "X:\\Codex\\pch-single\\LICENSE",
      "sha256": "ECC8DE64590E1CF285815344CAE4EB84E88A0B8E8EAC806B3B6145301F4C1789",
      "disposition": "COPIED"
    },
    {
      "migration_id": "MIG-037",
      "source": "X:\\Codex\\pch-single\\LICENSES\\PI-CODING-AGENT-MIT.txt",
      "sha256": "FA7FCFB50C38B85FD39754A8EBC5F21C71903819FB82C48C5781FD3FF25ECB65",
      "disposition": "COPIED"
    },
    {
      "migration_id": "MIG-038",
      "source": "X:\\Codex\\pch-single\\LICENSES\\README.md",
      "sha256": "12B173E285FB024A64FA3B5F4959D4892CB3F22103592A3FF8FCD3D86E68738C",
      "disposition": "COPIED"
    },
    {
      "migration_id": "MIG-039",
      "source": "X:\\Codex\\pch-single\\manifests\\ACCEPTANCE-CONTRACT.json",
      "sha256": "37DD75D9C17CAF795755761516144C61F2ABA6C5226CA2C2FCC13F73875FE750",
      "disposition": "COPIED"
    },
    {
      "migration_id": "MIG-040",
      "source": "X:\\Codex\\pch-single\\manifests\\CACHE-PROVIDER-EVIDENCE.json",
      "sha256": "961A4ADC80ECEADE91764D3B4DD94FAA0B2CB43B2EFCBA5BE3606E0A596325E6",
      "disposition": "COPIED"
    },
    {
      "migration_id": "MIG-041",
      "source": "X:\\Codex\\pch-single\\manifests\\QUEUED-SCOPE-EXTENSIONS.json",
      "sha256": "F1475492ED341015165268F7068EE05855A6C45EFACBD19D53B68A7099A9AAEB",
      "disposition": "COPIED"
    },
    {
      "migration_id": "MIG-042",
      "source": "X:\\Codex\\pch-single\\NOTICE",
      "sha256": "1DF08E646EC58069293463CEAD15A31FB1C76FB8AF640D09F07840D58FCB7BE9",
      "disposition": "COPIED"
    },
    {
      "migration_id": "MIG-043",